{
  "id": "AUT-CLOSE-AUT-STALE-A",
  "kind": "delivery_close_receipt",
  "schema_version": "delivery-close-receipt:v1",
  "profile_ref": {
    "id": "AUT-STALE-A",
    "path": ".sdlc/autonomy/deliveries/AUT-STALE-A.json",
    "hash": "5fca571cb32259cc3489099165b4408b3e0cd25b00ae4511c40925dc1eb5bb0f"
  },
  "delivery": {
    "id": "LOCAL-STALE-A",
    "kind": "local_release"
  },
  "start_receipt_ref": {
    "id": "AUT-START-AUT-STALE-A",
    "path": ".sdlc/autonomy/executions/AUT-STALE-A/start.json",
    "hash": "a83a22379d20bd2b557dced67f886168d77fa7a08c7e0e1d6456569ede2a0443"
  },
  "terminal_action_receipt_ref": {
    "id": "AUT-ACT-20261010043425787-7c652a",
    "path": ".sdlc/autonomy/actions/AUT-ACT-20261010043425787-7c652a.json",
    "hash": "b376df4520a39b56c1fc4f559c19962ee7221ace29e2f1f199a3026ac9b7c995"
  },
  "terminal_status": "released",
  "reason": "Completed passing terminal action release.local.",
  "approval": {
    "id": "APR-20261010043425-21d99b",
    "profile_id": "AUT-STALE-A",
    "status": "approved",
    "summary": "Approve the STALE-A local release",
    "scope": {
      "principle": "A human approval applies only to the specific artifact or decision shown to the user before the approval.",
      "subject_id": "AUT-STALE-A",
      "subject_label": "delivery action release.local for AUT-STALE-A",
      "applies_only_to_presented_subject": true,
      "does_not_approve_future_artifacts": true,
      "requires_fresh_user_confirmation_for_new_artifacts": true,
      "approval_level": "delivery-action:release.local"
    },
    "evidence": [],
    "approval_source": "explicit-user",
    "authorization_ref": null,
    "authorization_use_ref": null,
    "authorization_action": null,
    "explicit_user_confirmation": true,
    "provisional": false,
    "approved_content_hash": "a9b08d2eaa6505dbba99c13b02d77e8a00868bdcdeff1659ba63b65e6d6d9800",
    "hash_algorithm": "sha256:stable-json:v1",
    "approved_by": {
      "id": "antonioantenore",
      "type": "human",
      "name": "Finalization E2E",
      "email": "finalization-e2e@example.invalid",
      "source": "cli"
    },
    "git": {
      "is_git_repo": true,
      "branch": "codex/ST-STALE-A",
      "head_sha": "0c7e6e0ea94ce25d8c1fe0d78e4274954adefd90",
      "is_dirty": true,
      "user": {
        "name": "Finalization E2E",
        "email": "finalization-e2e@example.invalid"
      },
      "remotes": [
        "origin"
      ]
    },
    "run": {
      "run_id": null,
      "thread_id": null,
      "session_id": null,
      "tool": "agentic-sdlc-cli",
      "version": "0.94.0"
    },
    "created_at": "2026-10-10T04:34:25.314Z",
    "authority_assurance": {
      "mode": "audit_only"
    }
  },
  "closed_by": {
    "id": "codex",
    "type": "agent",
    "name": "Codex",
    "email": null,
    "source": "default"
  },
  "closed_at": "2026-10-10T04:34:26.862Z",
  "audit": {
    "git": {
      "is_git_repo": true,
      "branch": "codex/ST-STALE-A",
      "head_sha": "0c7e6e0ea94ce25d8c1fe0d78e4274954adefd90",
      "is_dirty": true,
      "user": {
        "name": "Finalization E2E",
        "email": "finalization-e2e@example.invalid"
      },
      "remotes": [
        "origin"
      ]
    },
    "run": {
      "run_id": null,
      "thread_id": null,
      "session_id": null,
      "tool": "agentic-sdlc-cli",
      "version": "0.94.0"
    }
  },
  "receipt_hash": "c24204a76aa875daffcac167d7ffe9cad2c40f99297ff04017cce0f830845dd6",
  "hash_algorithm": "sha256:stable-json:v1"
}
