{
  "id": "AUT-CLOSE-AUT-SUCCESSOR",
  "kind": "delivery_close_receipt",
  "schema_version": "delivery-close-receipt:v1",
  "profile_ref": {
    "id": "AUT-SUCCESSOR",
    "path": ".sdlc/autonomy/deliveries/AUT-SUCCESSOR.json",
    "hash": "bd75b646b0e27ff858681010c58e54ec5101f91179022be664ae9159de097a9a"
  },
  "delivery": {
    "id": "LOCAL-SUCCESSOR",
    "kind": "local_release"
  },
  "start_receipt_ref": {
    "id": "AUT-START-AUT-SUCCESSOR",
    "path": ".sdlc/autonomy/executions/AUT-SUCCESSOR/start.json",
    "hash": "a55da3065912a73470b552bd3ad8208a10bad32579ad50d5cbb7e76a1ac51cae"
  },
  "terminal_action_receipt_ref": null,
  "terminal_status": "cancelled",
  "reason": "The destination was rebuilt outside the governed build",
  "approval": {
    "id": "APR-20261010043301-b8c9a0",
    "profile_id": "AUT-SUCCESSOR",
    "status": "approved",
    "summary": "Close the first delivery as cancelled",
    "scope": {
      "principle": "A human approval applies only to the specific artifact or decision shown to the user before the approval.",
      "subject_id": "AUT-SUCCESSOR",
      "subject_label": "delivery close AUT-SUCCESSOR",
      "applies_only_to_presented_subject": true,
      "does_not_approve_future_artifacts": true,
      "requires_fresh_user_confirmation_for_new_artifacts": true,
      "approval_level": "delivery-terminal:cancelled"
    },
    "evidence": [],
    "approval_source": "explicit-user",
    "authorization_ref": null,
    "authorization_use_ref": null,
    "authorization_action": null,
    "explicit_user_confirmation": true,
    "provisional": false,
    "approved_content_hash": "6c27ae6391b9331bbed2532bf0a69723fccc0a073a9071157865072297781ff9",
    "hash_algorithm": "sha256:stable-json:v1",
    "approved_by": {
      "id": "antonioantenore",
      "type": "human",
      "name": "Finalization E2E",
      "email": "finalization-e2e@example.invalid",
      "source": "cli"
    },
    "git": {
      "is_git_repo": true,
      "branch": "codex/ST-SUCCESSOR",
      "head_sha": "7291c535a28adae4bfa3067988dfd51ac1ffda67",
      "is_dirty": true,
      "user": {
        "name": "Finalization E2E",
        "email": "finalization-e2e@example.invalid"
      },
      "remotes": [
        "origin"
      ]
    },
    "run": {
      "run_id": null,
      "thread_id": null,
      "session_id": null,
      "tool": "agentic-sdlc-cli",
      "version": "0.94.0"
    },
    "created_at": "2026-10-10T04:33:01.604Z"
  },
  "closed_by": {
    "id": "antonioantenore",
    "type": "human",
    "name": "Finalization E2E",
    "email": "finalization-e2e@example.invalid",
    "source": "cli"
  },
  "closed_at": "2026-10-10T04:33:01.604Z",
  "audit": {
    "git": {
      "is_git_repo": true,
      "branch": "codex/ST-SUCCESSOR",
      "head_sha": "7291c535a28adae4bfa3067988dfd51ac1ffda67",
      "is_dirty": true,
      "user": {
        "name": "Finalization E2E",
        "email": "finalization-e2e@example.invalid"
      },
      "remotes": [
        "origin"
      ]
    },
    "run": {
      "run_id": null,
      "thread_id": null,
      "session_id": null,
      "tool": "agentic-sdlc-cli",
      "version": "0.94.0"
    }
  },
  "receipt_hash": "60853d61661dd7e9aed4d0a346c61b60612697fad91ed2eba5284f65b55b15ab",
  "hash_algorithm": "sha256:stable-json:v1"
}
