{
  "id": "AUT-CLOSE-AUT-RECHK-A",
  "kind": "delivery_close_receipt",
  "schema_version": "delivery-close-receipt:v1",
  "profile_ref": {
    "id": "AUT-RECHK-A",
    "path": ".sdlc/autonomy/deliveries/AUT-RECHK-A.json",
    "hash": "9367f452f6bb1a8c92932de63b8f54a160bfd14b1c46ecbcac89b168e8ffca69"
  },
  "delivery": {
    "id": "LOCAL-RECHK-A",
    "kind": "local_release"
  },
  "start_receipt_ref": {
    "id": "AUT-START-AUT-RECHK-A",
    "path": ".sdlc/autonomy/executions/AUT-RECHK-A/start.json",
    "hash": "203ad54a895ee6028448141f578bd7266afa4ab00bc0f2ad28ab83dd7d9c1e95"
  },
  "terminal_action_receipt_ref": {
    "id": "AUT-ACT-20261010043528687-2e4479",
    "path": ".sdlc/autonomy/actions/AUT-ACT-20261010043528687-2e4479.json",
    "hash": "96a01c96a2f33d78a6d6d31e602b746e712905d521ff4506cfcb54f48bfecb89"
  },
  "terminal_status": "released",
  "reason": "Completed passing terminal action release.local.",
  "approval": {
    "id": "APR-20261010043528-338f00",
    "profile_id": "AUT-RECHK-A",
    "status": "approved",
    "summary": "Approve the RECHK-A local release",
    "scope": {
      "principle": "A human approval applies only to the specific artifact or decision shown to the user before the approval.",
      "subject_id": "AUT-RECHK-A",
      "subject_label": "delivery action release.local for AUT-RECHK-A",
      "applies_only_to_presented_subject": true,
      "does_not_approve_future_artifacts": true,
      "requires_fresh_user_confirmation_for_new_artifacts": true,
      "approval_level": "delivery-action:release.local"
    },
    "evidence": [],
    "approval_source": "explicit-user",
    "authorization_ref": null,
    "authorization_use_ref": null,
    "authorization_action": null,
    "explicit_user_confirmation": true,
    "provisional": false,
    "approved_content_hash": "c2e22bacd2268e8e055f7743219c9344e16922e5d4af3e607816de58321c4529",
    "hash_algorithm": "sha256:stable-json:v1",
    "approved_by": {
      "id": "antonioantenore",
      "type": "human",
      "name": "Finalization E2E",
      "email": "finalization-e2e@example.invalid",
      "source": "cli"
    },
    "git": {
      "is_git_repo": true,
      "branch": "codex/ST-RECHK-A",
      "head_sha": "de5b352ba474e4ca568ef4a6a9d7858f625c7937",
      "is_dirty": true,
      "user": {
        "name": "Finalization E2E",
        "email": "finalization-e2e@example.invalid"
      },
      "remotes": [
        "origin"
      ]
    },
    "run": {
      "run_id": null,
      "thread_id": null,
      "session_id": null,
      "tool": "agentic-sdlc-cli",
      "version": "0.94.0"
    },
    "created_at": "2026-10-10T04:35:28.282Z",
    "authority_assurance": {
      "mode": "audit_only"
    }
  },
  "closed_by": {
    "id": "codex",
    "type": "agent",
    "name": "Codex",
    "email": null,
    "source": "default"
  },
  "closed_at": "2026-10-10T04:35:29.661Z",
  "audit": {
    "git": {
      "is_git_repo": true,
      "branch": "codex/ST-RECHK-A",
      "head_sha": "de5b352ba474e4ca568ef4a6a9d7858f625c7937",
      "is_dirty": true,
      "user": {
        "name": "Finalization E2E",
        "email": "finalization-e2e@example.invalid"
      },
      "remotes": [
        "origin"
      ]
    },
    "run": {
      "run_id": null,
      "thread_id": null,
      "session_id": null,
      "tool": "agentic-sdlc-cli",
      "version": "0.94.0"
    }
  },
  "receipt_hash": "cca4b844d9e4ac06887259f9537bcdd3c1b67fefe1918054e43b040f6489a58f",
  "hash_algorithm": "sha256:stable-json:v1"
}
